threat_community,threat_id,definition,low,high,category,action_type
Technology Leadership,TC-01,"Technology leaders at the director level and above",40,80,employee,error
External Cyber Adversaries,TC-02,Hackers or external entities that attempt to penetrate Starbucks Technology systems,10,50,external,malicious
Environmental,TC-03,Natural disasters,20,80,natural,geological
Third Parties,TC-04,"Vendors and other organizations that work directly with our company",30,60,external,error
Regulators or Auditors,TC-05,Internal and external auditors and regulators,40,75,external,
External Litigants,TC-06,"Civil and criminal corporate litigation. Mostly employment matters.",30,50,external,competitive
